idno,Event,Site,Date,Round,WhitePlayer,BlackPlayer,Result,WhiteELO,BlackELO,ECO,WhiteRooks7th,BlackRooks7th,Caro,Slav
13913154, Earl tourn, ?, 1906.??.??, ?, Savrov, Alekhine Alexander, -1, ?, ?, C30, 0, 0, 0, 0, 
79034979, Earl tourn, ?, 1906.??.??, ?, Giese, Alekhine Alexander, -1, ?, ?, C47, 0, 0, 0, 0, 
45480091, Earl tourn, ?, 1906.??.??, ?, Alekhine Alexander, Ljubimov T., 1, ?, ?, C58, 0, 0, 0, 0, 
52151016, Earl tourn, ?, 1906.??.??, ?, Alekhine Alexander, Romaskevic, 1, ?, ?, C20, 0, 0, 0, 0, 
87016303, Earl tourn, ?, 1906.??.??, ?, Manko V., Alekhine Alexander, 1, ?, ?, C52, 0, 0, 0, 0, 
53186835, Earl tourn, ?, 1906.??.??, ?, Alekhine Alexander, Sachovskoj, 1, ?, ?, C52, 0, 0, 0, 0, 
72639291, Earl tourn, ?, 1906.??.??, ?, Alekhine Alexander, Savrov, 0, ?, ?, C22, 0, 0, 0, 0, 
18948653, Earl tourn, ?, 1906.??.??, ?, Alekhine Alexander, Zubakin N., -1, ?, ?, C33, 0, 0, 0, 0, 
69009801, Earl tourn, ?, 1906.??.??, ?, Alekhine Alexander, Zukovskij, 0, ?, ?, C51, 0, 0, 0, 0, 
41971593, Earl tourn, ?, 1906.??.??, ?, Alekhine Alexander, Giese, 1, ?, ?, C29, 0, 0, 0, 0, 
60893491, Earl tourn, ?, 1906.??.??, ?, Romaskevic, Alekhine Alexander, -1, ?, ?, C51, 0, 0, 0, 0, 
60174101, Earl tourn, ?, 1906.??.??, ?, Sachovskoj, Alekhine Alexander, -1, ?, ?, C38, 0, 0, 0, 0, 
21564619, Earl tourn, ?, 1906.??.??, ?, Alekhine Alexander, Vjachirev, 0, ?, ?, C80, 0, 0, 1, 0, 
20307528, Earl tourn, ?, 1906.??.??, ?, Zubakin N., Alekhine Alexander, 0, ?, ?, C55, 0, 0, 0, 0, 
19139687, Earl tourn, ?, 1906.??.??, ?, Zukovskij, Alekhine Alexander, -1, ?, ?, B13, 0, 0, 0, 0, 
47395253, corr, ?, 1907.??.??, ?, Alekhine Alexander, Manko V., 1, ?, ?, C47, 0, 0, 0, 0, 
86612965, corr, ?, 1907.??.??, ?, Viakhirev Apollon, Alekhine Alexander, -1, ?, ?, C28, 0, 0, 0, 0, 
31331941, Moscow, Moscow, 1907.??.??, ?, Alekhine Alexander, Rosanov Lev I, 1, ?, ?, C47, 0, 0, 0, 0, 
50172392, Duesseldorf, Duesseldorf, 1908.??.??, ?, Von Bardeleben Curt, Alekhine Alexander, -1, ?, ?, C41, 0, 0, 0, 0, 
41729992, Duesseldorf, Duesseldorf, 1908.??.??, ?, Alekhine Alexander, Neumann Augustin, -1, ?, ?, C78, 0, 0, 0, 0, 
15306787, Duesseldorf, Duesseldorf, 1908.??.??, ?, Alekhine Alexander, Koehnlein H., 1, ?, ?, D05, 0, 0, 0, 0, 
77201126, Duesseldorf, Duesseldorf, 1908.??.??, 1, Lasker Edward, Alekhine Alexander, -1, ?, ?, C41, 0, 0, 0, 0, 
40665550, Duesseldorf, Duesseldorf, 1908.??.??, 2, Alekhine Alexander, Kunze O., 1, ?, ?, C01, 0, 0, 0, 0, 
46178698, Duesseldorf, Duesseldorf, 1908.??.??, 3, Trcala St, Alekhine Alexander, -1, ?, ?, C77, 0, 0, 0, 0, 
97868078, Duesseldorf, Duesseldorf, 1908.??.??, 9, Wiarda A., Alekhine Alexander, 1, ?, ?, C63, 0, 0, 0, 0, 
37382149, Duesseldorf, Duesseldorf, 1908.??.??, 10, Alekhine Alexander, Gajdos Janos, 1, ?, ?, D32, 0, 0, 0, 0, 
61902173, All-Russian, St Petersburg, 1909.??.??, 1, Alekhine Alexander, Izbinsky Stefan, 1, ?, ?, B46, 0, 0, 0, 0, 
45318279, All-Russian+, St Petersburg, 1909.??.??, 2, Goldfarb J., Alekhine Alexander, -1, ?, ?, C01, 0, 0, 0, 0, 
42158411, All-Russian+, St Petersburg, 1909.??.??, 3, Alekhine Alexander, Rozanov V., 1, ?, ?, A40, 0, 0, 0, 0, 
21894522, All-Russian, St Petersburg, 1909.??.??, 4, Tschepurnoff Anatol Aleksievitis, Alekhine Alexander, 0, ?, ?, C00, 0, 0, 0, 0, 
4371640, All-Russian, St Petersburg, 1909.??.??, 5, Alekhine Alexander, Evtifeev Peter Artemievich, 1, ?, ?, D00, 0, 0, 0, 1, 
14304558, All-Russian, St Petersburg, 1909.??.??, 6, Tereshchenko Nikolay Semenovich, Alekhine Alexander, -1, ?, ?, A44, 0, 0, 0, 0, 
63928552, All-Russian, St Petersburg, 1909.??.??, 7, Alekhine Alexander, Gregory Bernhard, 1, ?, ?, C28, 0, 0, 0, 0, 
34203078, All-Russian, St Petersburg, 1909.??.??, 8, Verlinsky Boris, Alekhine Alexander, -1, ?, ?, C68, 0, 0, 0, 0, 
91323617, All-Russian, St Petersburg, 1909.??.??, 10, Alekhine Alexander, Romanovsky Peter Arsenievich, -1, ?, ?, C26, 0, 0, 0, 0, 
37584846, All-Russian, St Petersburg, 1909.??.??, 11, Eljaschoff Moissei Zacharowits, Alekhine Alexander, -1, ?, ?, C01, 0, 0, 0, 0, 
81298943, All-Russian, St Petersburg, 1909.??.??, 12, Alekhine Alexander, Nikolaev B., 1, ?, ?, C28, 0, 0, 0, 0, 
96796747, All-Russian, St Petersburg, 1909.??.??, 13, Lebedev Sergey Fedorovich, Alekhine Alexander, 0, ?, ?, A40, 0, 0, 0, 0, 
3573821, All-Russian, St Petersburg, 1909.??.??, 14, Alekhine Alexander, Viakhirev Apollon, 1, ?, ?, A84, 0, 0, 0, 0, 
88650626, All-Russian, St Petersburg, 1909.??.??, 15, Rosenkrantz Karl Wilhelm, Alekhine Alexander, -1, ?, ?, C14, 0, 0, 0, 0, 
87507517, All-Russian, St Petersburg, 1909.??.??, 16, Alekhine Alexander, Helbach Grigory, 1, ?, ?, C68, 0, 0, 0, 0, 
15589006, All-Russian, St Petersburg, 1909.??.??, 17, Rotlewi Georg A, Alekhine Alexander, -1, ?, ?, A40, 0, 0, 0, 0, 
77772847, All-Russian, St Petersburg, 1909.??.??, 18, Alekhine Alexander, Daniuszewski Dawid, -1, ?, ?, C28, 0, 0, 0, 0, 
72352491, All-Russian, St Petersburg, 1909.??.??, 19, Maliutin Boris Evgenievich, Alekhine Alexander, -1, ?, ?, C12, 0, 0, 0, 0, 
67168560, DSB-17.Kongress, Hamburg, 1910.??.??, 1, Schlechter Carl, Alekhine Alexander, 1, ?, ?, C41, 0, 0, 0, 0, 
85319119, DSB-17.Kongress+, Hamburg, 1910.??.??, 2, Alekhine Alexander, Jacob Franz, 0, ?, ?, D00, 0, 0, 0, 0, 
16987522, DSB-17.Kongress, Hamburg, 1910.??.??, 3, Speijer Abraham, Alekhine Alexander, -1, ?, ?, C15, 0, 0, 0, 0, 
28924276, DSB-17.Kongress, Hamburg, 1910.??.??, 4, Alekhine Alexander, Koehnlein Friedrich, 0, ?, ?, C30, 0, 1, 0, 0, 
44862803, DSB-17.Kongress, Hamburg, 1910.??.??, 5, Dus Chotimirsky Fedor Ivanovich, Alekhine Alexander, 0, ?, ?, A85, 0, 0, 0, 0, 
7774384, DSB-17.Kongress, Hamburg, 1910.??.??, 6, Alekhine Alexander, Leonhardt Paul Saladin, 1, ?, ?, D30, 0, 0, 0, 0, 
69757198, DSB-17.Kongress, Hamburg, 1910.??.??, 7, Spielmann Rudolf, Alekhine Alexander, 0, ?, ?, C77, 0, 0, 0, 0, 
55120500, DSB-17.Kongress, Hamburg, 1910.??.??, 8, Alekhine Alexander, Duras Oldrich, -1, ?, ?, D30, 0, 0, 0, 0, 
2830623, DSB-17.Kongress, Hamburg, 1910.??.??, 9, Nimzowitsch Aaron , Alekhine Alexander, 0, ?, ?, A80, 0, 0, 0, 0, 
66019256, DSB-17.Kongress, Hamburg, 1910.??.??, 10, Alekhine Alexander, Teichmann Richard, 0, ?, ?, C77, 0, 0, 0, 0, 
97349063, DSB-17.Kongress, Hamburg, 1910.??.??, 11, John Walter, Alekhine Alexander, -1, ?, ?, D02, 0, 0, 0, 0, 
74448546, DSB-17.Kongress, Hamburg, 1910.??.??, 12, Tarrasch Siegbert, Alekhine Alexander, 1, ?, ?, D40, 0, 0, 0, 0, 
48105043, DSB-17.Kongress, Hamburg, 1910.??.??, 13, Alekhine Alexander, Yates Frederick, 1, ?, ?, D55, 0, 0, 0, 0, 
844409, DSB-17.Kongress, Hamburg, 1910.??.??, 14, Forgacs Leo, Alekhine Alexander, 1, ?, ?, C78, 0, 0, 0, 0, 
18310155, DSB-17.Kongress, Hamburg, 1910.??.??, 15, Alekhine Alexander, Tartakower Saviely, 1, ?, ?, A85, 0, 0, 0, 0, 
49173579, DSB-17.Kongress, Hamburg, 1910.??.??, 16, Marshall Frank James, Alekhine Alexander, 0, ?, ?, D46, 0, 0, 0, 0, 
3501931, DSB-17.Kongress, Hamburg, 1910.??.??, 17, Alekhine Alexander, Salwe Georg, 0, ?, ?, E12, 0, 0, 0, 0, 
53931100, Cologne, Cologne, 1911.??.??, ?, Rotlewi Georg A, Alekhine Alexander, -1, ?, ?, A84, 0, 0, 0, 0, 
85929951, Cologne, Cologne, 1911.??.??, ?, Alekhine Alexander, Freymann S., 1, ?, ?, C66, 0, 0, 0, 0, 
42079931, Cologne, Cologne, 1911.??.??, ?, Alekhine Alexander, Tenner Oscar, 1, ?, ?, C30, 0, 0, 0, 0, 
35284137, Karlsbad, Karlsbad, 1911.??.??, ?, Alekhine Alexander, Chajes Oscar, 1, ?, ?, B40, 0, 0, 0, 0, 
41827297, Karlsbad, Karlsbad, 1911.??.??, ?, Alekhine Alexander, Cohn Erich, 1, ?, ?, C46, 0, 0, 0, 0, 
3689442, Karlsbad, Karlsbad, 1911.??.??, ?, Alekhine Alexander, Dus Chotimirsky Fedor Ivanovich, 1, ?, ?, A22, 0, 0, 0, 0, 
14383349, Karlsbad, Karlsbad, 1911.??.??, ?, Alekhine Alexander, Fahrni Hans, 0, ?, ?, C01, 0, 0, 0, 0, 
45215453, Karlsbad, Karlsbad, 1911.??.??, ?, Alekhine Alexander, Johner Paul F, -1, ?, ?, C31, 0, 0, 0, 0, 
57849453, Karlsbad, Karlsbad, 1911.??.??, ?, Alekhine Alexander, Leonhardt Paul Saladin, -1, ?, ?, B40, 0, 0, 0, 0, 
47223438, Karlsbad, Karlsbad, 1911.??.??, ?, Alekhine Alexander, Levenfish Grigory, 0, ?, ?, C82, 0, 0, 0, 0, 
74685892, Karlsbad, Karlsbad, 1911.??.??, ?, Alekhine Alexander, Rotlewi Georg A, 1, ?, ?, C77, 0, 0, 0, 0, 
64099933, Karlsbad, Karlsbad, 1911.??.??, ?, Alekhine Alexander, Salwe Georg, 0, ?, ?, C53, 0, 0, 0, 0, 
36254324, Karlsbad, Karlsbad, 1911.??.??, ?, Alekhine Alexander, Schlechter Carl, -1, ?, ?, B01, 0, 0, 0, 0, 
93458875, Karlsbad, Karlsbad, 1911.??.??, ?, Alekhine Alexander, Tartakower Saviely, 1, ?, ?, D30, 0, 0, 0, 0, 
71958173, Karlsbad, Karlsbad, 1911.??.??, ?, Alekhine Alexander, Teichmann Richard, -1, ?, ?, C84, 0, 0, 0, 0, 
99410427, Karlsbad, Karlsbad, 1911.??.??, ?, Alekhine Alexander, Vidmar Milan Sr, 1, ?, ?, C49, 0, 0, 0, 0, 
38793615, Karlsbad, Karlsbad, 1911.??.??, ?, Burn Amos, Alekhine Alexander, 1, ?, ?, C13, 0, 0, 0, 0, 
34842048, Karlsbad, Karlsbad, 1911.??.??, ?, Duras Oldrich, Alekhine Alexander, -1, ?, ?, D46, 0, 0, 0, 0, 
16794550, Karlsbad, Karlsbad, 1911.??.??, ?, Jaffe Charles, Alekhine Alexander, -1, ?, ?, C27, 0, 0, 0, 0, 
76117603, Karlsbad, Karlsbad, 1911.??.??, ?, Kostic Boris, Alekhine Alexander, -1, ?, ?, D46, 0, 0, 0, 0, 
10390334, Karlsbad, Karlsbad, 1911.??.??, ?, Marshall Frank James, Alekhine Alexander, 0, ?, ?, D05, 0, 0, 0, 1, 
86943961, Karlsbad, Karlsbad, 1911.??.??, ?, Alapin Simon, Alekhine Alexander, -1, ?, ?, C42, 0, 0, 0, 0, 
80460023, Karlsbad, Karlsbad, 1911.??.??, ?, Nimzowitsch Aaron , Alekhine Alexander, 0, ?, ?, C62, 0, 0, 0, 0, 
59564477, Karlsbad, Karlsbad, 1911.??.??, ?, Perlis Julius, Alekhine Alexander, 1, ?, ?, C49, 0, 0, 0, 0, 
92605593, Karlsbad, Karlsbad, 1911.??.??, ?, Rabinovich Abram, Alekhine Alexander, 1, ?, ?, B12, 0, 0, 0, 0, 
31368134, Karlsbad, Karlsbad, 1911.??.??, ?, Rubinstein Akiba, Alekhine Alexander, 1, ?, ?, D15, 0, 0, 0, 0, 
99409524, Karlsbad, Karlsbad, 1911.??.??, ?, Spielmann Rudolf, Alekhine Alexander, 1, ?, ?, B15, 0, 0, 0, 0, 
88046710, Karlsbad, Karlsbad, 1911.??.??, ?, Suechting Hugo, Alekhine Alexander, -1, ?, ?, C07, 0, 0, 0, 0, 
99648512, Stockholm, Stockholm, 1912.??.??, ?, Nyholm Gustaf, Alekhine Alexander, -1, ?, ?, C44, 0, 0, 0, 0, 
32750123, Stockholm, Stockholm, 1912.??.??, ?, Spielmann Rudolf, Alekhine Alexander, -1, ?, ?, C24, 0, 0, 0, 0, 
80564762, Stockholm, Stockholm, 1912.??.??, 1, Sjoberg Victor, Alekhine Alexander, -1, ?, ?, A85, 0, 0, 0, 0, 
28371497, Stockholm, Stockholm, 1912.??.??, 2, Alekhine Alexander, Marco Georg, 1, ?, ?, C41, 0, 0, 0, 0, 
42812865, Stockholm, Stockholm, 1912.??.??, 3, Fridlizius J., Alekhine Alexander, 1, ?, ?, C77, 0, 0, 0, 0, 
48086025, Stockholm, Stockholm, 1912.??.??, 4, Alekhine Alexander, Cohn Erich, 1, ?, ?, C45, 0, 0, 0, 0, 
47615411, Stockholm, Stockholm, 1912.??.??, 5, Langborg H., Alekhine Alexander, -1, ?, ?, C53, 0, 0, 0, 0, 
76724641, Stockholm, Stockholm, 1912.??.??, 7, Alekhine Alexander, Olland Adolf Georg, 1, ?, ?, C01, 0, 0, 0, 0, 
97592875, Stockholm, Stockholm, 1912.??.??, 9, Alekhine Alexander, Englund Fritz, 0, ?, ?, C00, 0, 0, 0, 0, 
54084736, Stockholm, Stockholm, 1912.??.??, 11, Alekhine Alexander, Giersing Johannes Hjalmar, 1, ?, ?, C00, 0, 0, 0, 0, 
92649638, RUS-ch, Vilnius, 1912.??.??, ?, Rabinovich Abram, Alekhine Alexander, -1, ?, ?, B40, 0, 0, 0, 0, 
91371078, RUS-ch, Vilnius, 1912.??.??, ?, Bernstein Ossip, Alekhine Alexander, -1, ?, ?, D94, 0, 0, 0, 0, 
25771070, RUS-ch, Vilnius, 1912.??.??, ?, Nimzowitsch Aaron , Alekhine Alexander, -1, ?, ?, D02, 0, 0, 0, 0, 
4865926, RUS-ch, Vilnius, 1912.??.??, ?, Levenfish Grigory, Alekhine Alexander, -1, ?, ?, C77, 0, 0, 0, 0, 
6381262, RUS-ch, Vilnius, 1912.??.??, ?, Alekhine Alexander, Bernstein Ossip, 1, ?, ?, B85, 0, 0, 1, 0, 
17196911, RUS-ch, Vilnius, 1912.??.??, ?, Alekhine Alexander, Levitsky Stepan M, -1, ?, ?, A25, 0, 0, 0, 0, 
17127094, RUS-ch, Vilnius, 1912.??.??, 1, Alekhine Alexander, Nimzowitsch Aaron , 0, ?, ?, A46, 0, 0, 0, 0, 
13140591, RUS-ch, Vilnius, 1912.??.??, 5, Alekhine Alexander, Rubinstein Akiba, -1, ?, ?, C83, 0, 0, 0, 0, 
26376461, RUS-ch, Vilnius, 1912.??.??, 6, Salwe Georg, Alekhine Alexander, -1, ?, ?, A47, 0, 0, 0, 0, 
99957622, RUS-ch, Vilnius, 1912.??.??, 7, Alekhine Alexander, Levenfish Grigory, 1, ?, ?, B41, 0, 0, 0, 0, 
4742247, RUS-ch, Vilnius, 1912.??.??, 8, Von Freyman Sergey, Alekhine Alexander, 1, ?, ?, A85, 0, 0, 0, 0, 
19659327, RUS-ch, Vilnius, 1912.??.??, 9, Alekhine Alexander, Alapin Simon, -1, ?, ?, C00, 0, 0, 0, 0, 
19604514, RUS-ch, Vilnius, 1912.??.??, 19, Alekhine Alexander, Von Freyman Sergey, 0, ?, ?, C48, 0, 0, 0, 0, 
14920169, Paris, Paris, 1913.??.??, ?, Rodzinski, Alekhine Alexander, -1, ?, ?, C50, 0, 0, 0, 0, 
12344069, Paris mt, Paris, 1913.??.??, 1, Lasker Edward, Alekhine Alexander, -1, ?, ?, C46, 0, 0, 0, 0, 
39954936, Paris mt, Paris, 1913.??.??, 2, Alekhine Alexander, Lasker Edward, 1, ?, ?, C28, 0, 0, 0, 0, 
54800602, Paris mt, Paris, 1913.??.??, 3, Lasker Edward, Alekhine Alexander, -1, ?, ?, A82, 0, 0, 0, 0, 
37836907, Scheveningen, Scheveningen, 1913.??.??, ?, Alekhine Alexander, Breyer Gyula, 1, ?, ?, D68, 0, 0, 0, 0, 
180867, Scheveningen, Scheveningen, 1913.??.??, ?, Alekhine Alexander, Englund Fritz, 1, ?, ?, D00, 0, 0, 0, 0, 
18554594, Scheveningen, Scheveningen, 1913.??.??, ?, Alekhine Alexander, Geus K., 1, ?, ?, C01, 0, 0, 0, 0, 
84198507, Scheveningen, Scheveningen, 1913.??.??, ?, Alekhine Alexander, Janowsky Dawid Markelowicz, 1, ?, ?, D68, 0, 0, 0, 0, 
27391465, Scheveningen, Scheveningen, 1913.??.??, ?, Alekhine Alexander, Schelfhout Willem, 1, ?, ?, C25, 0, 0, 0, 0, 
75014433, Scheveningen, Scheveningen, 1913.??.??, ?, Alekhine Alexander, Te Kolste Jan Willem, 1, ?, ?, A54, 0, 1, 0, 0, 
6078615, Scheveningen, Scheveningen, 1913.??.??, ?, Yates Frederick, Alekhine Alexander, 0, ?, ?, C91, 0, 0, 0, 0, 
7006211, Scheveningen, Scheveningen, 1913.??.??, ?, Lasker Edward, Alekhine Alexander, -1, ?, ?, C46, 0, 0, 0, 0, 
75697814, Scheveningen, Scheveningen, 1913.??.??, ?, Loman Rudolf, Alekhine Alexander, -1, ?, ?, C84, 0, 0, 0, 0, 
8821987, Scheveningen, Scheveningen, 1913.??.??, ?, Mieses Jacques, Alekhine Alexander, -1, ?, ?, C22, 0, 1, 0, 0, 
99813192, Scheveningen, Scheveningen, 1913.??.??, ?, Olland Adolf Georg, Alekhine Alexander, -1, ?, ?, C61, 0, 0, 0, 0, 
7547200, Scheveningen, Scheveningen, 1913.??.??, ?, Speijer Abraham, Alekhine Alexander, -1, ?, ?, C41, 0, 0, 0, 0, 
77244547, St Petersburg exhibition, St Petersburg, 1913.??.??, ?, Capablanca Jose Raul, Alekhine Alexander, 1, ?, ?, D30, 0, 0, 0, 0, 
93702473, St Petersburg exhibition, St Petersburg, 1913.??.??, ?, Alekhine Alexander, Capablanca Jose Raul, -1, ?, ?, C90, 0, 0, 0, 0, 
15706585, St Petersburg, St Petersburg, 1913.??.??, ?, Alekhine Alexander, Bogoljubow Efim, -1, ?, ?, C64, 0, 0, 0, 0, 
76756595, St Petersburg, St Petersburg, 1913.??.??, ?, Loewenfisch Grigori, Alekhine Alexander, 1, ?, ?, A46, 0, 0, 0, 0, 
2101688, St Petersburg m, St Petersburg, 1913.??.??, 1, Levitsky Stepan M, Alekhine Alexander, -1, ?, ?, C33, 0, 0, 0, 0, 
99869123, St Petersburg, St Petersburg, 1913.??.??, 1, Alekhine Alexander, Lowcki Moishe Leopoldowicz, -1, ?, ?, A85, 0, 0, 0, 0, 
75762050, St Petersburg, St Petersburg, 1913.??.??, 1, Alekhine Alexander, Duras Oldrich, 1, ?, ?, C77, 0, 0, 0, 0, 
55058932, St Petersburg m, St Petersburg, 1913.??.??, 2, Alekhine Alexander, Levitsky Stepan M, 1, ?, ?, C33, 0, 0, 0, 0, 
85398278, St Petersburg m, St Petersburg, 1913.??.??, 3, Levitsky Stepan M, Alekhine Alexander, -1, ?, ?, C50, 0, 0, 0, 0, 
64116629, St Petersburg m, St Petersburg, 1913.??.??, 4, Alekhine Alexander, Levitsky Stepan M, -1, ?, ?, C26, 0, 0, 0, 0, 
4299879, St Petersburg m, St Petersburg, 1913.??.??, 5, Levitsky Stepan M, Alekhine Alexander, 1, ?, ?, C22, 0, 0, 0, 0, 
37776695, St Petersburg m, St Petersburg, 1913.??.??, 6, Alekhine Alexander, Levitsky Stepan M, 1, ?, ?, C25, 0, 0, 0, 0, 
70646498, St Petersburg m, St Petersburg, 1913.??.??, 7, Levitsky Stepan M, Alekhine Alexander, 1, ?, ?, C50, 0, 0, 0, 0, 
28327159, St Petersburg m, St Petersburg, 1913.??.??, 8, Alekhine Alexander, Levitsky Stepan M, 1, ?, ?, C27, 0, 0, 0, 0, 
90233949, St Petersburg m, St Petersburg, 1913.??.??, 9, Levitsky Stepan M, Alekhine Alexander, -1, ?, ?, C44, 0, 0, 0, 0, 
80731162, St Petersburg m, St Petersburg, 1913.??.??, 10, Alekhine Alexander, Levitsky Stepan M, 1, ?, ?, C23, 0, 0, 0, 0, 
28727930, St Petersburg, St Petersburg, 1913.??.??, 11, Freymann S., Alekhine Alexander, -1, ?, ?, D30, 0, 0, 0, 0, 
81268907, St Petersburg, St Petersburg, 1913.??.??, 12, Alekhine Alexander, Gregory Bernhard, -1, ?, ?, D00, 0, 0, 0, 0, 
71699074, DSB-19.Kongress, Mannheim, 1914.??.??, 1, Duras Oldrich, Alekhine Alexander, -1, ?, ?, C68, 0, 0, 0, 0, 
8874583, DSB-19.Kongress, Mannheim, 1914.??.??, 2, Alekhine Alexander, Krueger Paul, 0, ?, ?, C12, 0, 0, 0, 0, 
68230510, DSB-19.Kongress, Mannheim, 1914.??.??, 3, Post Ehrhardt, Alekhine Alexander, -1, ?, ?, C68, 0, 0, 0, 0, 
55015992, DSB-19.Kongress, Mannheim, 1914.??.??, 4, Alekhine Alexander, Breyer Gyula, 1, ?, ?, C50, 0, 0, 0, 0, 
88975746, DSB-19.Kongress, Mannheim, 1914.??.??, 5, Carls Carl Johan Margot, Alekhine Alexander, -1, ?, ?, A13, 0, 0, 0, 0, 
74234821, DSB-19.Kongress, Mannheim, 1914.??.??, 6, Janowsky Dawid Markelowicz, Alekhine Alexander, 1, ?, ?, A46, 0, 0, 0, 0, 
19107417, DSB-19.Kongress, Mannheim, 1914.??.??, 7, Alekhine Alexander, Bogoljubow Efim, 1, ?, ?, C26, 0, 0, 0, 0, 
87154807, DSB-19.Kongress, Mannheim, 1914.??.??, 8, Flamberg Aleksander Dawidow, Alekhine Alexander, -1, ?, ?, C83, 0, 0, 0, 0, 
534494, DSB-19.Kongress, Mannheim, 1914.??.??, 9, Alekhine Alexander, Tarrasch Siegbert, 1, ?, ?, C53, 0, 0, 0, 0, 
26811598, DSB-19.Kongress, Mannheim, 1914.??.??, 10, Mieses Jacques, Alekhine Alexander, -1, ?, ?, C50, 0, 0, 0, 0, 
87525927, DSB-19.Kongress, Mannheim, 1914.??.??, 11, Alekhine Alexander, Fahrni Hans, 1, ?, ?, C13, 0, 0, 0, 0, 
8935255, St Petersburg f, St Petersburg, 1914.??.??, ?, Alekhine Alexander, Lasker Emanuel, -1, ?, ?, C68, 0, 0, 0, 0, 
49150042, St Petersburg prel, St Petersburg, 1914.??.??, ?, Nimzowitsch Aaron , Alekhine Alexander, 0, ?, ?, C02, 0, 0, 0, 0, 
69425877, St Petersburg prel, St Petersburg, 1914.??.??, ?, Alekhine Alexander, Bernstein Ossip, 0, ?, ?, C66, 0, 0, 0, 0, 
67036981, St Petersburg prel, St Petersburg, 1914.??.??, ?, Tarrasch Siegbert, Alekhine Alexander, 0, ?, ?, C01, 0, 0, 0, 0, 
42195286, St Petersburg prel, St Petersburg, 1914.??.??, ?, Rubinstein Akiba, Alekhine Alexander, -1, ?, ?, E43, 0, 0, 0, 0, 
72226475, St Petersburg prel, St Petersburg, 1914.??.??, ?, Alekhine Alexander, Marshall Frank James, 1, ?, ?, C42, 0, 0, 0, 0, 
8865261, St Petersburg prel, St Petersburg, 1914.??.??, ?, Alekhine Alexander, Janowsky Dawid Markelowicz, 0, ?, ?, C01, 0, 0, 0, 0, 
96305716, St Petersburg prel, St Petersburg, 1914.??.??, ?, Lasker Emanuel, Alekhine Alexander, 0, ?, ?, B01, 0, 0, 0, 0, 
54731920, St Petersburg prel, St Petersburg, 1914.??.??, ?, Alekhine Alexander, Capablanca Jose Raul, -1, ?, ?, C66, 0, 0, 0, 0, 
81531167, St Petersburg prel, St Petersburg, 1914.??.??, ?, Alekhine Alexander, Blackburne Joseph Henry, 0, ?, ?, C61, 0, 0, 0, 0, 
37461529, St Petersburg prel, St Petersburg, 1914.??.??, ?, Gunsberg Isidor, Alekhine Alexander, -1, ?, ?, C53, 0, 0, 0, 0, 
5291633, St Petersburg f, St Petersburg, 1914.??.??, ?, Alekhine Alexander, Capablanca Jose Raul, 0, ?, ?, C48, 0, 0, 0, 0, 
36512928, St Petersburg, St Petersburg, 1914.??.??, ?, Lebedev Sergey Fedorovich, Alekhine Alexander, -1, ?, ?, A80, 0, 0, 0, 0, 
80745033, St Petersburg f, St Petersburg, 1914.??.??, ?, Alekhine Alexander, Marshall Frank James, 0, ?, ?, C49, 0, 0, 0, 0, 
72847361, St Petersburg f, St Petersburg, 1914.??.??, ?, Alekhine Alexander, Tarrasch Siegbert, 1, ?, ?, C32, 0, 0, 0, 0, 
79310304, St Petersburg f, St Petersburg, 1914.??.??, ?, Capablanca Jose Raul, Alekhine Alexander, 1, ?, ?, C11, 0, 0, 0, 0, 
62369956, St Petersburg f, St Petersburg, 1914.??.??, ?, Marshall Frank James, Alekhine Alexander, -1, ?, ?, C12, 0, 0, 0, 0, 
90823583, St Petersburg f, St Petersburg, 1914.??.??, ?, Lasker Emanuel, Alekhine Alexander, 1, ?, ?, D08, 0, 0, 0, 0, 
30952391, St Petersburg f, St Petersburg, 1914.??.??, ?, Tarrasch Siegbert, Alekhine Alexander, -1, ?, ?, C12, 0, 0, 0, 0, 
50937067, St Petersburg, St Petersburg, 1914.??.??, 3, Flamberg Aleksander Dawidow, Alekhine Alexander, -1, ?, ?, C84, 0, 0, 0, 0, 
8484246, St Petersburg, St Petersburg, 1914.??.??, 5, Salwe Georg, Alekhine Alexander, -1, ?, ?, D40, 0, 0, 0, 0, 
24042559, St Petersburg, St Petersburg, 1914.??.??, 6, Alekhine Alexander, Levitsky Stepan M, 1, ?, ?, C43, 0, 0, 0, 0, 
69728402, St Petersburg, St Petersburg, 1914.??.??, 8, Alekhine Alexander, Loewenfisch Grigori, 1, ?, ?, C77, 0, 0, 0, 0, 
61633184, St Petersburg, St Petersburg, 1914.??.??, 10, Alekhine Alexander, Nimzowitsch Aaron , 1, ?, ?, C82, 0, 0, 0, 0, 
58534110, St Petersburg, St Petersburg, 1914.??.??, 15, Znosko Borovsky Eugene , Alekhine Alexander, -1, ?, ?, C50, 0, 0, 0, 0, 
33109747, St Petersburg, St Petersburg, 1914.??.??, 17, Alapin Simon, Alekhine Alexander, -1, ?, ?, C77, 0, 0, 0, 0, 
13527638, Stockholm sim, Stockholm, 1914.??.??, ?, Beskov K., Alekhine Alexander, 0, ?, ?, C01, 0, 0, 0, 0, 
60273486, Stockholm sim, Stockholm, 1914.??.??, ?, Schultz E., Alekhine Alexander, -1, ?, ?, B77, 0, 0, 0, 0, 
86336839, Stockholm sim, Stockholm, 1914.??.??, ?, Alekhine Alexander, NN, 1, ?, ?, A03, 0, 0, 0, 0, 
51940976, Stockholm sim, Stockholm, 1914.??.??, ?, Alekhine Alexander, Malmgren, -1, ?, ?, D03, 0, 0, 0, 0, 
95615420, Moscow, Moscow, 1915.??.??, ?, Grigoriev Nikolay Dmitrievich, Alekhine Alexander, -1, ?, ?, C12, 0, 0, 0, 0, 
74119352, Moscow, Moscow, 1915.??.??, ?, Levashov E., Alekhine Alexander, 0, ?, ?, C12, 0, 0, 0, 0, 
6217276, Moscow, Moscow, 1915.??.??, ?, Alekhine Alexander, Zubarev Nikolay, 1, ?, ?, E32, 0, 0, 0, 0, 
89662460, Moscow, Moscow, 1915.??.??, ?, Tselikov Nikolay, Alekhine Alexander, -1, ?, ?, A46, 0, 0, 0, 0, 
50459531, Moscow, Moscow, 1915.??.??, 1, Rabinovich Ilya Leontievich, Alekhine Alexander, -1, ?, ?, C44, 0, 0, 0, 0, 
64669708, Moscow, Moscow, 1915.??.??, 2, Alekhine Alexander, Tselikov Nikolay, 1, ?, ?, C68, 0, 0, 0, 0, 
92255146, Moscow, Moscow, 1915.??.??, 3, Nazarovsky SV., Alekhine Alexander, -1, ?, ?, C50, 0, 0, 0, 0, 
90477699, Moscow, Moscow, 1915.??.??, 4, Nenarokov Vladimir Ivanovich, Alekhine Alexander, -1, ?, ?, E13, 0, 0, 0, 0, 
17791350, Moscow, Moscow, 1915.??.??, 5, Alekhine Alexander, Iordansky PK., 0, ?, ?, D32, 0, 0, 0, 0, 
41162552, Odessa sim, Odessa, 1916.??.??, ?, Alekhine Alexander, Gruenberg, 1, ?, ?, C30, 0, 0, 0, 0, 
59666758, Odessa sim, Odessa, 1916.??.??, ?, Alekhine Alexander, NN, 1, ?, ?, C21, 0, 0, 0, 0, 
98637375, Odessa sim, Odessa, 1916.??.??, ?, Alekhine Alexander, Vajnstejn S., 1, ?, ?, D53, 0, 0, 0, 0, 
87962697, Odessa sim, Odessa, 1916.??.??, ?, Alekhine Alexander, Velikanov, 1, ?, ?, C34, 0, 0, 0, 0, 
41739699, Odessa sim, Odessa, 1916.??.??, ?, Loran/Vladimirov, Alekhine Alexander, -1, ?, ?, C45, 0, 0, 0, 0, 
62565819, Odessa sim, Odessa, 1916.??.??, ?, Verlinsky Boris, Alekhine Alexander, 0, ?, ?, C62, 0, 0, 0, 0, 
56553799, Odessa sim, Odessa, 1916.??.??, ?, Alekhine Alexander, Feldt, 1, ?, ?, C11, 0, 0, 0, 0, 
7056363, Odessa sim, Odessa, 1916.??.??, ?, Verlinsky Boris, Alekhine Alexander, 1, ?, ?, C45, 0, 0, 0, 0, 
22060255, Moscow m, Moscow, 1918.??.??, ?, Alekhine Alexander, Rabinovich Abram, 1, ?, ?, C31, 0, 0, 0, 0, 
69326006, Moscow m, Moscow, 1918.??.??, ?, Rabinovich Abram, Alekhine Alexander, 0, ?, ?, C83, 0, 0, 0, 0, 
78501608, Moscow m, Moscow, 1918.??.??, ?, Rabinovich Abram, Alekhine Alexander, -1, ?, ?, C62, 0, 0, 0, 0, 
21115243, Moscow m, Moscow, 1918.??.??, ?, Alekhine Alexander, Rabinovich Abram, 1, ?, ?, C42, 0, 0, 0, 0, 
82511868, Odessa m, Odessa, 1918.??.??, ?, Alekhine Alexander, Verlinsky Boris, 1, ?, ?, C44, 0, 0, 0, 0, 
87716162, Odessa m, Odessa, 1918.??.??, ?, Alekhine Alexander, Verlinsky Boris, 1, ?, ?, C68, 0, 0, 0, 0, 
62235504, Odessa m, Odessa, 1918.??.??, ?, Alekhine Alexander, Verlinsky Boris, 1, ?, ?, D02, 0, 0, 0, 1, 
93428378, Odessa m, Odessa, 1918.??.??, ?, Alekhine Alexander, Verlinsky Boris, 1, ?, ?, B45, 0, 0, 0, 0, 
26420070, Odessa m, Odessa, 1918.??.??, ?, Verlinsky Boris, Alekhine Alexander, -1, ?, ?, C38, 0, 0, 0, 0, 
85570903, Odessa m, Odessa, 1918.??.??, ?, Verlinsky Boris, Alekhine Alexander, -1, ?, ?, B12, 0, 0, 0, 0, 
73921539, Moscow, Moscow, 1919.??.??, ?, Alekhine Alexander, Grigoriev Nikolay Dmitrievich, 1, ?, ?, C65, 0, 0, 0, 0, 
9753519, Moscow, Moscow, 1919.??.??, ?, Grigoriev Nikolay Dmitrievich, Alekhine Alexander, -1, ?, ?, C67, 0, 0, 0, 0, 
8986642, Moscow, Moscow, 1919.??.??, ?, Lubimov, Alekhine Alexander, -1, ?, ?, C41, 0, 0, 0, 0, 
43806625, Moscow, Moscow, 1919.??.??, ?, Zubarev Nikolay, Alekhine Alexander, -1, ?, ?, D00, 0, 0, 0, 0, 
84607433, Moscow, Moscow, 1919.??.??, ?, Alekhine Alexander, Isakov Dmitrij, 1, ?, ?, C21, 0, 0, 0, 0, 
84987075, Moscow, Moscow, 1919.??.??, ?, Alekhine Alexander, Grigoriev Nikolay Dmitrievich, 1, ?, ?, C61, 0, 0, 0, 0, 
15083318, URS-ch01, Moscow, 1920.??.??, 1, Grigoriev Nikolay Dmitrievich, Alekhine Alexander, -1, ?, ?, C60, 0, 0, 0, 0, 
64064732, URS-ch01, Moscow, 1920.??.??, 5, Pavlov Pianov Nikolay, Alekhine Alexander, -1, ?, ?, C01, 0, 0, 0, 0, 
19289363, URS-ch01, Moscow, 1920.??.??, 6, Alekhine Alexander, Levenfish Grigory, 0, ?, ?, D40, 0, 0, 0, 0, 
2948915, URS-ch01, Moscow, 1920.??.??, 7, Ilyin Zhenevsky Alexander, Alekhine Alexander, 0, ?, ?, C77, 0, 0, 0, 0, 
99559737, URS-ch01, Moscow, 1920.??.??, 12, Romanovsky Peter Arsenievich, Alekhine Alexander, 0, ?, ?, C48, 0, 0, 0, 0, 
55938386, URS-ch01, Moscow, 1920.??.??, 13, Rabinovich Ilya Leontievich, Alekhine Alexander, -1, ?, ?, E43, 0, 0, 0, 0, 
67891016, URS-ch01, Moscow, 1920.??.??, 15, Daniuszewski Dawid, Alekhine Alexander, 0, ?, ?, B40, 0, 0, 0, 0, 
