idno,Event,Site,Date,Round,WhitePlayer,BlackPlayer,Result,WhiteELO,BlackELO,ECO,WhiteRooks7th,BlackRooks7th,Caro,Slav
5192473, San Remo, San Remo, 1930.??.??, ?, Alekhine Alexander, Kmoch Hans, 1, ?, ?, E51, 0, 0, 0, 0, 
71246652, San Remo, San Remo, 1930.??.??, ?, Ahues Carl Oscar, Alekhine Alexander, -1, ?, ?, A47, 0, 0, 0, 0, 
3242919, Stockholm sim, Stockholm, 1930.??.??, ?, Alekhine Alexander, Johansson Niklas, -1, ?, ?, D51, 0, 0, 0, 0, 
37365656, Stockholm sim, Stockholm, 1930.??.??, ?, Alekhine Alexander, Magnusson Gunnar, -1, ?, ?, B30, 0, 0, 0, 0, 
65454514, Stockholm sim, Stockholm, 1930.??.??, ?, Alekhine Alexander, Werner E., -1, ?, ?, C01, 0, 0, 0, 0, 
22715101, Vienna sim, Vienna, 1930.??.??, ?, Alekhine Alexander, Maurer, 1, ?, ?, D52, 0, 0, 1, 0, 
74441681, Vienna sim, Vienna, 1930.??.??, ?, Alekhine Alexander, Glassberg P., -1, ?, ?, B70, 0, 0, 0, 0, 
4816138, Vienna sim, Vienna, 1930.??.??, ?, Alekhine Alexander, Glueckmann F., -1, ?, ?, D61, 0, 0, 0, 0, 
76465899, Belgrade sim, Belgrade, 1931.??.??, ?, Alekhine Alexander, Ormai, 1, ?, ?, C51, 0, 0, 1, 0, 
44056947, Belgrade sim, Belgrade, 1931.??.??, ?, Alekhine Alexander, Elacic, 1, ?, ?, C13, 0, 0, 0, 0, 
81317996, Belgrade sim, Belgrade, 1931.??.??, ?, Alekhine Alexander, Kondic, -1, ?, ?, E20, 0, 0, 0, 0, 
61746002, Belgrade sim, Belgrade, 1931.??.??, ?, Alekhine Alexander, Lugowski S., 1, ?, ?, C25, 0, 0, 0, 0, 
44728986, Belgrade sim, Belgrade, 1931.??.??, ?, Alekhine Alexander, Dobrovic, 1, ?, ?, C07, 0, 0, 0, 0, 
65394788, Belgrade sim, Belgrade, 1931.??.??, ?, Alekhine Alexander, Petrovic V., 1, ?, ?, C11, 0, 0, 0, 0, 
39790869, Belgrade sim, Belgrade, 1931.??.??, ?, Alekhine Alexander, Tomovic Vasilje, -1, ?, ?, B30, 0, 1, 0, 0, 
3610997, Belgrade sim, Belgrade, 1931.??.??, ?, Alekhine Alexander, Tot Bora, 0, ?, ?, E11, 0, 0, 0, 0, 
73488777, Belgrade sim, Belgrade, 1931.??.??, ?, Alekhine Alexander, Vukovic Sava, 0, ?, ?, D63, 0, 0, 0, 0, 
42504485, Bled, Bled, 1931.??.??, ?, Nimzowitsch Aaron , Alekhine Alexander, -1, ?, ?, B13, 0, 0, 0, 0, 
59058336, Bled, Bled, 1931.??.??, ?, Pirc Vasja, Alekhine Alexander, -1, ?, ?, D32, 0, 0, 0, 0, 
12261806, Bled, Bled, 1931.??.??, ?, Spielmann Rudolf, Alekhine Alexander, 0, ?, ?, D36, 0, 0, 0, 0, 
77815664, Bled, Bled, 1931.??.??, ?, Stoltz Goesta, Alekhine Alexander, -1, ?, ?, C71, 0, 0, 0, 0, 
23797000, Bled, Bled, 1931.??.??, ?, Tartakower Saviely, Alekhine Alexander, 0, ?, ?, C77, 0, 0, 0, 0, 
13548045, Bled, Bled, 1931.??.??, ?, Maroczy Geza, Alekhine Alexander, -1, ?, ?, B13, 0, 0, 0, 0, 
67487672, Bled, Bled, 1931.??.??, ?, Vidmar Milan Sr, Alekhine Alexander, 0, ?, ?, D46, 0, 0, 0, 0, 
73135103, Bled, Bled, 1931.??.??, ?, Flohr Salo, Alekhine Alexander, 0, ?, ?, C13, 0, 0, 0, 0, 
33674247, Bled, Bled, 1931.??.??, ?, Colle Edgar, Alekhine Alexander, -1, ?, ?, D34, 0, 0, 0, 0, 
8804375, Bled, Bled, 1931.??.??, ?, Bogoljubow Efim, Alekhine Alexander, -1, ?, ?, E33, 0, 0, 0, 0, 
7866554, Bled, Bled, 1931.??.??, ?, Asztalos Lajos, Alekhine Alexander, 0, ?, ?, C11, 0, 0, 0, 0, 
80279385, Bled, Bled, 1931.??.??, ?, Alekhine Alexander, Vidmar Milan Sr, 1, ?, ?, D55, 0, 0, 0, 0, 
74185710, Bled, Bled, 1931.??.??, ?, Alekhine Alexander, Tartakower Saviely, 1, ?, ?, B07, 0, 0, 0, 0, 
38359059, Bled, Bled, 1931.??.??, ?, Alekhine Alexander, Stoltz Goesta, 1, ?, ?, D17, 0, 0, 1, 0, 
48724052, Bled, Bled, 1931.??.??, ?, Alekhine Alexander, Spielmann Rudolf, 0, ?, ?, D55, 0, 0, 0, 0, 
14934073, Bled, Bled, 1931.??.??, ?, Alekhine Alexander, Pirc Vasja, 1, ?, ?, D30, 0, 0, 0, 0, 
90013739, Bled, Bled, 1931.??.??, ?, Alekhine Alexander, Nimzowitsch Aaron , 1, ?, ?, C15, 0, 0, 0, 0, 
38258457, Bled, Bled, 1931.??.??, ?, Alekhine Alexander, Maroczy Geza, 1, ?, ?, D66, 0, 0, 0, 0, 
37913032, Bled, Bled, 1931.??.??, ?, Alekhine Alexander, Kostic Boris, 1, ?, ?, D04, 0, 0, 0, 0, 
60487441, Bled, Bled, 1931.??.??, ?, Alekhine Alexander, Kashdan Isaac, 0, ?, ?, D52, 0, 0, 0, 0, 
12138921, Bled, Bled, 1931.??.??, ?, Alekhine Alexander, Flohr Salo, 1, ?, ?, D28, 0, 0, 0, 0, 
78689857, Bled, Bled, 1931.??.??, ?, Alekhine Alexander, Colle Edgar, 1, ?, ?, D51, 0, 0, 0, 0, 
37036414, Bled, Bled, 1931.??.??, ?, Alekhine Alexander, Bogoljubow Efim, 0, ?, ?, D70, 0, 0, 0, 0, 
72085981, Bled, Bled, 1931.??.??, ?, Alekhine Alexander, Asztalos Lajos, 0, ?, ?, D60, 0, 0, 0, 0, 
7943229, Bled, Bled, 1931.??.??, ?, Kostic Boris, Alekhine Alexander, 0, ?, ?, C45, 0, 0, 0, 0, 
32860460, Bled, Bled, 1931.??.??, ?, Kashdan Isaac, Alekhine Alexander, 0, ?, ?, C48, 0, 0, 0, 0, 
23985019, Nice consult, Nice, 1931.??.??, ?, Alekhine/Monosson, Stoltz/Reilly, 1, ?, ?, E17, 0, 0, 0, 0, 
73232116, Nice consult, Nice, 1931.??.??, ?, Alekhine/Reilly, Flohr/Monosson, 0, ?, ?, E16, 0, 0, 0, 0, 
58903664, Nice consult, Nice, 1931.??.??, ?, Alekhine/Reilly, Stoltz/Monosson, 0, ?, ?, C45, 0, 0, 0, 0, 
11506365, Nice consult, Nice, 1931.??.??, ?, Stoltz/Reilly, Alekhine/Monosson, 0, ?, ?, E21, 0, 0, 0, 0, 
3765820, Nice consult, Nice, 1931.??.??, ?, Stoltz/Monosson, Alekhine/Reilly, -1, ?, ?, D52, 0, 0, 0, 0, 
73255405, Nice consult, Nice, 1931.??.??, ?, Alekhine/Monosson, Flohr/Reilly, 1, ?, ?, E24, 0, 0, 0, 0, 
40578653, Nice consult, Nice, 1931.??.??, ?, Flohr/Monosson, Alekhine/Reilly, 0, ?, ?, E35, 0, 0, 0, 0, 
52458502, Paris sim, Paris, 1931.??.??, ?, Alekhine Alexander, Tartakower Cukierman, -1, ?, ?, B30, 0, 0, 0, 0, 
24602698, Paris sim, Paris, 1931.??.??, ?, Alekhine Alexander, British Chess Club, 1, ?, ?, C68, 0, 0, 0, 0, 
9825796, Paris sim, Paris, 1931.??.??, ?, Alekhine Alexander, Wurzburger, 0, ?, ?, D43, 0, 0, 0, 0, 
24410394, Paris sim, Paris, 1931.??.??, ?, Alekhine Alexander, Glikberg  DI., 0, ?, ?, D43, 0, 0, 0, 0, 
57582713, Paris sim, Paris, 1931.??.??, ?, Alekhine Alexander, Rudenko A., 0, ?, ?, C50, 0, 0, 0, 0, 
76810231, Paris sim, Paris, 1931.??.??, ?, Alekhine Alexander, Russian Chess Circle, 1, ?, ?, A51, 0, 0, 0, 0, 
23010311, Paris sim, Paris, 1931.??.??, ?, Alekhine Alexander, Vardonenko, 1, ?, ?, C30, 0, 0, 0, 0, 
43990360, Prague ol, Prague, 1931.??.??, 1, Alekhine Alexander, Gruenfeld Ernst, 1, ?, ?, D41, 0, 0, 0, 0, 
59086038, Prague ol, Prague, 1931.??.??, 2, Stahlberg Gideon, Alekhine Alexander, -1, ?, ?, E35, 0, 0, 0, 0, 
30091080, Prague ol, Prague, 1931.??.??, 3, Alekhine Alexander, Vidmar Milan Sr, 0, ?, ?, C48, 0, 0, 0, 0, 
98889710, Prague ol, Prague, 1931.??.??, 4, Mikenas Vladas, Alekhine Alexander, 0, ?, ?, D52, 0, 0, 0, 0, 
23271859, Prague ol, Prague, 1931.??.??, 5, Alekhine Alexander, Kashdan Isaac, 0, ?, ?, D67, 0, 0, 0, 0, 
67806914, Prague ol, Prague, 1931.??.??, 6, Christoffersen HC., Alekhine Alexander, -1, ?, ?, A47, 0, 0, 0, 0, 
45807726, Prague ol, Prague, 1931.??.??, 7, Alekhine Alexander, Sultan Khan Mir, 0, ?, ?, E15, 0, 0, 0, 0, 
5451025, Prague ol, Prague, 1931.??.??, 8, Rosselli del Turco Stefano, Alekhine Alexander, -1, ?, ?, A47, 0, 0, 0, 0, 
86324531, Prague ol, Prague, 1931.??.??, 9, Alekhine Alexander, Weenink Henri Gerard, 1, ?, ?, D12, 0, 0, 0, 0, 
99537664, Prague ol, Prague, 1931.??.??, 10, Bogoljubow Efim, Alekhine Alexander, 0, ?, ?, C01, 0, 0, 0, 0, 
10417989, Prague ol, Prague, 1931.??.??, 11, Alekhine Alexander, Johner Hans, 1, ?, ?, E11, 0, 0, 0, 0, 
1430961, Prague ol, Prague, 1931.??.??, 12, Golmayo de la Torriente Manuel, Alekhine Alexander, 0, ?, ?, C76, 0, 0, 0, 0, 
91230866, Prague ol, Prague, 1931.??.??, 13, Alekhine Alexander, Erdelyi Stefan, 1, ?, ?, B54, 0, 0, 0, 0, 
22111900, Prague ol, Prague, 1931.??.??, 14, Tartakower Saviely, Alekhine Alexander, 0, ?, ?, C01, 0, 0, 0, 0, 
96453822, Prague ol, Prague, 1931.??.??, 15, Alekhine Alexander, Andersen Erik Sr, 1, ?, ?, A50, 0, 0, 0, 0, 
5547781, Prague ol, Prague, 1931.??.??, 16, Matisons Hermanis, Alekhine Alexander, 1, ?, ?, C46, 0, 0, 0, 0, 
63312371, Prague ol, Prague, 1931.??.??, 17, Alekhine Alexander, Steiner Endre, 1, ?, ?, A32, 0, 0, 0, 0, 
57693437, Prague ol, Prague, 1931.??.??, 18, Flohr Salo, Alekhine Alexander, -1, ?, ?, C46, 0, 0, 0, 0, 
49885063, Bern, Bern, 1932.??.??, 1, Alekhine Alexander, Sultan Khan Mir, 1, ?, ?, B13, 0, 0, 0, 0, 
22842603, Bern, Bern, 1932.??.??, 2, Staehelin Adolf, Alekhine Alexander, -1, ?, ?, E34, 0, 0, 0, 0, 
5901487, Bern, Bern, 1932.??.??, 3, Alekhine Alexander, Grob Henry, 1, ?, ?, C84, 0, 0, 0, 0, 
40516225, Bern, Bern, 1932.??.??, 4, Voellmy Erwin, Alekhine Alexander, -1, ?, ?, D48, 0, 0, 0, 0, 
15417683, Bern, Bern, 1932.??.??, 5, Alekhine Alexander, Euwe Max, 0, ?, ?, B14, 0, 0, 0, 0, 
38490929, Bern, Bern, 1932.??.??, 6, Bernstein Ossip, Alekhine Alexander, -1, ?, ?, C68, 0, 0, 0, 0, 
40492714, Bern, Bern, 1932.??.??, 7, Alekhine Alexander, Flohr Salo, 1, ?, ?, D05, 0, 0, 0, 1, 
8148680, Bern, Bern, 1932.??.??, 8, Gygli Fritz, Alekhine Alexander, 0, ?, ?, D27, 0, 0, 0, 0, 
90719609, Bern, Bern, 1932.??.??, 9, Alekhine Alexander, Johner Hans, 1, ?, ?, D32, 0, 0, 1, 0, 
88514970, Bern, Bern, 1932.??.??, 10, Bogoljubow Efim, Alekhine Alexander, 1, ?, ?, D45, 0, 0, 0, 0, 
39946916, Bern, Bern, 1932.??.??, 11, Alekhine Alexander, Rivier W., 1, ?, ?, D02, 0, 0, 0, 0, 
87148662, Bern, Bern, 1932.??.??, 12, Henneberger Walter, Alekhine Alexander, -1, ?, ?, C46, 0, 0, 0, 0, 
36607967, Bern, Bern, 1932.??.??, 13, Alekhine Alexander, Naegeli Oskar, 0, ?, ?, D63, 0, 0, 0, 0, 
58264220, Bern, Bern, 1932.??.??, 14, Alekhine Alexander, Johner Paul F, 1, ?, ?, E16, 0, 0, 0, 0, 
25475772, Bern, Bern, 1932.??.??, 15, Colin B., Alekhine Alexander, -1, ?, ?, D41, 0, 0, 0, 0, 
50499310, London, London, 1932.??.??, 1, Alekhine Alexander, Sultan Khan Mir, 1, ?, ?, E38, 0, 0, 0, 0, 
31230890, London, London, 1932.??.??, 2, Menchik Vera, Alekhine Alexander, -1, ?, ?, E14, 0, 0, 0, 0, 
64260928, London, London, 1932.??.??, 3, Alekhine Alexander, Winter William, 1, ?, ?, B13, 0, 0, 0, 0, 
97905323, London, London, 1932.??.??, 4, Milner Barry Philip Stuart, Alekhine Alexander, -1, ?, ?, C28, 0, 0, 0, 0, 
34509915, London, London, 1932.??.??, 5, Alekhine Alexander, Berger Victor, 1, ?, ?, B15, 0, 0, 0, 0, 
72729257, London, London, 1932.??.??, 6, Kashdan Isaac, Alekhine Alexander, 0, ?, ?, D85, 0, 0, 0, 0, 
87332641, London, London, 1932.??.??, 7, Alekhine Alexander, Tartakower Saviely, 1, ?, ?, A51, 0, 0, 0, 0, 
40780302, London, London, 1932.??.??, 8, Maroczy Geza, Alekhine Alexander, 0, ?, ?, C46, 0, 0, 0, 0, 
7416189, London, London, 1932.??.??, 9, Alekhine Alexander, Koltanowski George, 1, ?, ?, C73, 0, 0, 0, 0, 
70037586, London, London, 1932.??.??, 10, Alekhine Alexander, Flohr Salo, 0, ?, ?, E16, 0, 0, 0, 0, 
84924555, London, London, 1932.??.??, 11, Thomas George Alan, Alekhine Alexander, 0, ?, ?, C73, 0, 0, 0, 0, 
824123, Los Angeles sim, Los Angeles, 1932.??.??, ?, Alekhine Alexander, Mc Bride R., -1, ?, ?, A82, 0, 0, 0, 0, 
26975150, Los Angeles sim, Los Angeles, 1932.??.??, ?, Alekhine Alexander, Lamb W., -1, ?, ?, D10, 0, 0, 0, 0, 
38135541, Los Angeles sim, Los Angeles, 1932.??.??, ?, Alekhine Alexander, Howe, 1, ?, ?, D53, 0, 0, 0, 0, 
52961958, Los Angeles sim, Los Angeles, 1932.??.??, ?, Alekhine Alexander, Haegg, 1, ?, ?, D61, 0, 0, 0, 0, 
24271838, Los Angeles sim, Los Angeles, 1932.??.??, ?, Alekhine Alexander, Scholtz M., -1, ?, ?, B13, 0, 0, 0, 0, 
91237025, Los Angeles sim, Los Angeles, 1932.??.??, ?, Alekhine Alexander, Vorkapich Sawyer, 1, ?, ?, D05, 0, 0, 0, 0, 
89510680, Mexico City, Mexico, 1932.??.??, 1, Acevedo Maria, Alekhine Alexander, -1, ?, ?, D32, 0, 0, 0, 0, 
57909550, Mexico City, Mexico, 1932.??.??, 2, Alekhine Alexander, Gonzalez Rojo E., 1, ?, ?, B02, 0, 0, 0, 0, 
12425326, Mexico City, Mexico, 1932.??.??, 3, Soto Larrea M., Alekhine Alexander, -1, ?, ?, D26, 0, 0, 0, 0, 
99838132, Mexico City, Mexico, 1932.??.??, 4, Alekhine Alexander, Vazquez J., 1, ?, ?, D51, 0, 0, 0, 0, 
49014290, Mexico City, Mexico, 1932.??.??, 5, Araiza Munoz Jose Joaquin, Alekhine Alexander, -1, ?, ?, D15, 0, 0, 0, 0, 
93727997, Mexico City, Mexico, 1932.??.??, 6, Alekhine Alexander, Kashdan Isaac, 0, ?, ?, C79, 0, 0, 0, 0, 
79472301, Mexico City, Mexico, 1932.??.??, 7, Asiain J., Alekhine Alexander, -1, ?, ?, B29, 0, 0, 0, 0, 
83369116, Mexico City, Mexico, 1932.??.??, 8, Alekhine Alexander, Brunner Erich, 1, ?, ?, D36, 0, 0, 0, 0, 
49971197, Mexico City, Mexico, 1932.??.??, 9, Medina J., Alekhine Alexander, -1, ?, ?, E00, 0, 0, 0, 0, 
97479236, New York sim, New York, 1932.??.??, ?, Alekhine Alexander, Evening Post, 1, ?, ?, C88, 0, 0, 0, 0, 
19421254, New York sim, New York, 1932.??.??, ?, Alekhine Alexander, Varnum/Bruzza/Ruberl, 0, ?, ?, C28, 0, 0, 0, 0, 
98818187, New York sim, New York, 1932.??.??, ?, Alekhine Alexander, New York Athletic Cl, 1, ?, ?, D61, 0, 0, 0, 0, 
26078137, New York sim, New York, 1932.??.??, ?, Alekhine Alexander, Rosenthal Volkman, 0, ?, ?, C90, 0, 0, 0, 0, 
3155745, New York sim, New York, 1932.??.??, ?, Alekhine Alexander, Park Avenue CC, 0, ?, ?, D35, 0, 0, 0, 0, 
74419289, New York sim, New York, 1932.??.??, ?, Alekhine Alexander, Newman/Mac Murray, 0, ?, ?, D63, 0, 0, 0, 0, 
38962023, New York sim, New York, 1932.??.??, ?, Alekhine Alexander, New York University, 0, ?, ?, E17, 0, 0, 0, 0, 
93045731, New York sim, New York, 1932.??.??, ?, Alekhine Alexander, Mc Clellan Herrick, 0, ?, ?, E17, 0, 0, 0, 0, 
56382054, New York sim, New York, 1932.??.??, ?, Alekhine Alexander, Levenstein/Grossman, 0, ?, ?, B03, 0, 0, 0, 0, 
20973085, New York sim, New York, 1932.??.??, ?, Alekhine Alexander, James/Madison/High, -1, ?, ?, C47, 0, 0, 0, 0, 
9069712, New York sim, New York, 1932.??.??, ?, Alekhine Alexander, Herisse/Tolins/Hassialis, 1, ?, ?, B62, 0, 0, 0, 0, 
60642664, New York sim, New York, 1932.??.??, ?, Alekhine Alexander, Grossman N., -1, ?, ?, B85, 0, 0, 0, 0, 
26165527, New York sim, New York, 1932.??.??, ?, Alekhine Alexander, Green/Montgomery/Sard, 1, ?, ?, D32, 0, 0, 0, 0, 
93226597, New York sim, New York, 1932.??.??, ?, Alekhine Alexander, Grafman/Sandford/Griffith, 0, ?, ?, C68, 0, 0, 0, 0, 
83673863, New York sim, New York, 1932.??.??, ?, Alekhine Alexander, Flatbush CC., 0, ?, ?, C68, 0, 0, 0, 0, 
72380930, New York sim, New York, 1932.??.??, ?, Alekhine Alexander, Casey/Schaeffer/Lyon, -1, ?, ?, C90, 0, 0, 0, 0, 
84602807, New York sim, New York, 1932.??.??, ?, Alekhine Alexander, Carpenter/Rosenthal, 1, ?, ?, C90, 0, 0, 0, 0, 
69891942, New York sim, New York, 1932.??.??, ?, Alekhine Alexander, Brooklyn College, 0, ?, ?, C90, 0, 0, 0, 0, 
50912222, New York sim, New York, 1932.??.??, ?, Alekhine Alexander, Brooklyn CC, 0, ?, ?, C28, 0, 0, 0, 0, 
94409909, Pasadena, Pasadena, 1932.??.??, ?, Bernstein Jacob, Alekhine Alexander, -1, ?, ?, E43, 0, 0, 0, 0, 
94694155, Pasadena, Pasadena, 1932.??.??, ?, Araiza Munoz Jose Joaquin, Alekhine Alexander, -1, ?, ?, D04, 0, 0, 0, 0, 
49622870, Pasadena, Pasadena, 1932.??.??, ?, Alekhine Alexander, Steiner Herman, 1, ?, ?, C78, 0, 0, 0, 0, 
69198189, Pasadena, Pasadena, 1932.??.??, ?, Alekhine Alexander, Kashdan Isaac, 1, ?, ?, D36, 0, 0, 0, 0, 
33340125, Pasadena, Pasadena, 1932.??.??, ?, Alekhine Alexander, Fine Reuben, 0, ?, ?, B02, 0, 1, 0, 0, 
4141367, Pasadena, Pasadena, 1932.??.??, ?, Alekhine Alexander, Borochow Harry, 1, ?, ?, C82, 0, 0, 0, 0, 
94766562, Pasadena, Pasadena, 1932.??.??, ?, Alekhine Alexander, Reshevsky Samuel Herman, 1, ?, ?, D35, 0, 0, 0, 0, 
46811163, Pasadena, Pasadena, 1932.??.??, ?, Reinfeld Fred, Alekhine Alexander, 0, ?, ?, D48, 0, 0, 0, 0, 
22525718, Pasadena, Pasadena, 1932.??.??, ?, Fink Adolf, Alekhine Alexander, -1, ?, ?, C44, 0, 0, 0, 0, 
32049276, Pasadena, Pasadena, 1932.??.??, ?, Dake Arthur William, Alekhine Alexander, 1, ?, ?, B13, 0, 0, 0, 0, 
10040554, Pasadena, Pasadena, 1932.??.??, ?, Factor Samuel, Alekhine Alexander, 0, ?, ?, B02, 0, 0, 1, 0, 
81301646, Toronto sim, Toronto, 1932.??.??, ?, Alekhine Alexander, Anderson BM., 0, ?, ?, D31, 0, 0, 0, 0, 
1183785, Toronto sim, Toronto, 1932.??.??, ?, Alekhine Alexander, Gale SE., -1, ?, ?, C87, 0, 0, 0, 0, 
40028028, Toronto sim, Toronto, 1932.??.??, ?, Alekhine Alexander, Hoffman, -1, ?, ?, C25, 0, 0, 0, 0, 
21687138, Toronto sim, Toronto, 1932.??.??, ?, Alekhine Alexander, Luvstrand D., -1, ?, ?, E20, 0, 0, 0, 0, 
33352359, Amsterdam sim, Amsterdam, 1933.??.??, ?, Alekhine Alexander, Hulscher, 1, ?, ?, C62, 0, 0, 0, 0, 
77478197, Amsterdam sim, Amsterdam, 1933.??.??, ?, Alekhine Alexander, Kleefstra, -1, ?, ?, C80, 0, 0, 0, 0, 
72830675, Amsterdam sim, Amsterdam, 1933.??.??, ?, Alekhine Alexander, Prins Lodewijk, -1, ?, ?, A40, 0, 0, 0, 0, 
52077701, Amsterdam sim, Amsterdam, 1933.??.??, ?, Alekhine Alexander, Frijda, -1, ?, ?, C11, 0, 0, 0, 0, 
55972277, Amsterdam sim, Amsterdam, 1933.??.??, ?, Alekhine Alexander, Euwe Max, 1, ?, ?, B10, 0, 0, 0, 0, 
18160244, Amsterdam sim, Amsterdam, 1933.??.??, ?, Alekhine Alexander, Mulder, 0, ?, ?, D63, 0, 0, 0, 0, 
69500876, Bandung sim, Bandung, 1933.??.??, ?, Alekhine Alexander, Piso RJ., 0, ?, ?, D06, 0, 0, 0, 0, 
43283518, Bandung sim, Bandung, 1933.??.??, ?, Alekhine Alexander, Grijns GW., -1, ?, ?, C78, 0, 0, 0, 0, 
50103462, Bandung sim, Bandung, 1933.??.??, ?, Alekhine Alexander, Baljet Lindenaar, 1, ?, ?, A60, 0, 0, 0, 0, 
55214818, Bandung sim, Bandung, 1933.??.??, ?, Alekhine Alexander, Ellerbrock Manfred, 1, ?, ?, C68, 0, 0, 0, 0, 
37700534, Bandung sim, Bandung, 1933.??.??, ?, Alekhine Alexander, De Wit, 1, ?, ?, D18, 0, 0, 0, 0, 
24268091, Bandung sim, Bandung, 1933.??.??, ?, Alekhine Alexander, Asmai/Padar/Kartosoe, 1, ?, ?, C10, 0, 0, 0, 0, 
79032985, Bandung sim, Bandung, 1933.??.??, ?, Alekhine Alexander, Onnen PW., 1, ?, ?, C11, 0, 0, 0, 0, 
59471476, Bandung sim, Bandung, 1933.??.??, ?, Alekhine Alexander, Onnen PW., 1, ?, ?, B41, 0, 0, 0, 0, 
95177722, Bandung sim, Bandung, 1933.??.??, ?, Alekhine Alexander, Tampboelon Moersid, 1, ?, ?, B14, 0, 0, 0, 0, 
3156941, Basel sim, Basel, 1933.??.??, ?, Alekhine Alexander, Schabad, 1, ?, ?, D00, 0, 0, 0, 0, 
94107369, Basel sim, Basel, 1933.??.??, ?, Alekhine Alexander, Meck K., 1, ?, ?, D05, 0, 0, 0, 0, 
61985199, Basel sim, Basel, 1933.??.??, ?, Alekhine Alexander, Mueller P., -1, ?, ?, D60, 0, 0, 0, 0, 
62398092, Basel sim, Basel, 1933.??.??, ?, Alekhine Alexander, Freivogel, -1, ?, ?, D52, 0, 0, 0, 0, 
90560925, Basel sim, Basel, 1933.??.??, ?, Alekhine Alexander, Keller E., 0, ?, ?, B13, 0, 0, 0, 0, 
28204769, Basel sim, Basel, 1933.??.??, ?, Alekhine Alexander, Duhm D., 0, ?, ?, C68, 0, 0, 0, 0, 
55233656, Chicago sim blindfold, Chicago, 1933.??.??, ?, Alekhine Alexander, Moore Jean, 0, ?, ?, C53, 0, 0, 0, 0, 
40202191, Chicago sim blindfold, Chicago, 1933.??.??, ?, Alekhine Alexander, Mezirov, 0, ?, ?, B07, 0, 0, 0, 0, 
6207740, Chicago sim blindfold, Chicago, 1933.??.??, ?, Alekhine Alexander, Wagner EA., 1, ?, ?, A40, 0, 0, 0, 0, 
17162917, Chicago sim blindfold, Chicago, 1933.??.??, ?, Alekhine Alexander, Kohler, 1, ?, ?, B01, 0, 0, 0, 0, 
5685450, Chicago sim blindfold, Chicago, 1933.??.??, ?, Alekhine Alexander, Hawley G., 1, ?, ?, D55, 0, 0, 0, 0, 
88290515, Chicago sim blindfold, Chicago, 1933.??.??, ?, Alekhine Alexander, Engholm NG., 1, ?, ?, B02, 0, 0, 0, 0, 
35399458, Chicago sim blindfold, Chicago, 1933.??.??, ?, Alekhine Alexander, Bisno, 1, ?, ?, A81, 0, 0, 0, 0, 
26134547, Chicago sim blindfold, Chicago, 1933.??.??, ?, Alekhine Alexander, Anderson Arthur, 1, ?, ?, C45, 0, 0, 0, 0, 
65960848, Chicago sim blindfold, Chicago, 1933.??.??, ?, Alekhine Alexander, Sheffield Virginia, 1, ?, ?, C36, 0, 0, 0, 0, 
46603632, Folkestone ol, Folkestone, 1933.??.??, 1, Alekhine Alexander, Soultanbeieff Victor Ivanovich, 1, ?, ?, D30, 0, 0, 0, 0, 
43992310, Folkestone ol, Folkestone, 1933.??.??, 2, Alekhine Alexander, Tartakower Saviely, -1, ?, ?, D58, 0, 0, 0, 0, 
48185516, Folkestone ol, Folkestone, 1933.??.??, 3, Kashdan Isaac, Alekhine Alexander, 0, ?, ?, D41, 0, 0, 0, 0, 
33481345, Folkestone ol, Folkestone, 1933.??.??, 4, Alekhine Alexander, Apsenieks Fricis, 1, ?, ?, D30, 0, 0, 0, 0, 
22942605, Folkestone ol, Folkestone, 1933.??.??, 5, Sultan Khan Mir, Alekhine Alexander, -1, ?, ?, D02, 0, 0, 0, 0, 
18415212, Folkestone ol, Folkestone, 1933.??.??, 8, Alekhine Alexander, Andersen Erik Sr, 1, ?, ?, C62, 0, 0, 0, 0, 
62925244, Folkestone ol, Folkestone, 1933.??.??, 9, Rosselli del Turco Stefano, Alekhine Alexander, 0, ?, ?, D40, 0, 0, 0, 0, 
58850479, Folkestone ol, Folkestone, 1933.??.??, 10, Alekhine Alexander, Mikenas Vladas, 1, ?, ?, B06, 0, 0, 0, 0, 
74606482, Folkestone ol, Folkestone, 1933.??.??, 11, Steiner Lajos, Alekhine Alexander, -1, ?, ?, C86, 0, 0, 0, 0, 
938501, Folkestone ol, Folkestone, 1933.??.??, 13, Alekhine Alexander, Stahlberg Gideon, 0, ?, ?, C11, 0, 0, 0, 0, 
10570101, Folkestone ol, Folkestone, 1933.??.??, 14, Alekhine Alexander, Asgeirsson Asmundur, 1, ?, ?, A46, 0, 0, 0, 0, 
38095393, Folkestone ol, Folkestone, 1933.??.??, 15, Fairhurst William Albert, Alekhine Alexander, -1, ?, ?, D41, 0, 0, 0, 0, 
30289062, Hastings3334, Hastings, 1933.??.??, 1, Tylor Theodore, Alekhine Alexander, 0, ?, ?, C42, 0, 0, 0, 0, 
52594241, Hastings3334, Hastings, 1933.??.??, 2, Menchik Vera, Alekhine Alexander, -1, ?, ?, A43, 0, 0, 0, 0, 
5918388, Hastings3334, Hastings, 1933.??.??, 3, Alekhine Alexander, Lilienthal Andor, 1, ?, ?, A22, 0, 0, 0, 0, 
23406250, Hastings3334, Hastings, 1933.??.??, 4, Thomas George Alan, Alekhine Alexander, 0, ?, ?, C41, 0, 0, 0, 0, 
39316931, Hastings3334, Hastings, 1933.??.??, 5, Alekhine Alexander, Alexander Conel Hughes, 0, ?, ?, C43, 0, 1, 0, 0, 
92106857, Hastings3334, Hastings, 1933.??.??, 6, Milner Barry Philip Stuart, Alekhine Alexander, -1, ?, ?, B02, 0, 0, 0, 0, 
84878789, Hastings3334, Hastings, 1933.??.??, 7, Alekhine Alexander, Eliskases Erich Gottlieb, 0, ?, ?, E24, 0, 0, 0, 0, 
48489295, Hastings3334, Hastings, 1933.??.??, 8, Flohr Salo, Alekhine Alexander, 0, ?, ?, D02, 0, 0, 0, 0, 
93140461, Hastings3334, Hastings, 1933.??.??, 9, Alekhine Alexander, Michell Reginald Pryce, 1, ?, ?, C79, 0, 0, 0, 0, 
81593355, Hong Kong sim, Hong Kong, 1933.??.??, ?, Alekhine Alexander, Evans, 1, ?, ?, D06, 0, 0, 0, 0, 
51523868, Hong Kong sim, Hong Kong, 1933.??.??, ?, Alekhine Alexander, Destur RA., 1, ?, ?, D06, 0, 0, 0, 0, 
40109117, Hong Kong sim, Hong Kong, 1933.??.??, ?, Alekhine Alexander, Gledhill HB., 1, ?, ?, D36, 0, 0, 0, 0, 
22094068, Hong Kong sim, Hong Kong, 1933.??.??, ?, Alekhine Alexander, Gledhill HB., 1, ?, ?, C48, 0, 0, 0, 0, 
62372577, Hong Kong sim, Hong Kong, 1933.??.??, ?, Alekhine Alexander, Moore, 1, ?, ?, C30, 0, 0, 0, 0, 
87427417, Hong Kong sim, Hong Kong, 1933.??.??, ?, Alekhine Alexander, Desai RE., 1, ?, ?, C65, 0, 0, 0, 0, 
32369976, Hong Kong sim, Hong Kong, 1933.??.??, ?, Alekhine Alexander, De Carvalho D., 0, ?, ?, C23, 0, 0, 0, 0, 
10744064, Hong Kong sim, Hong Kong, 1933.??.??, ?, Alekhine Alexander, De Carvalho D., 1, ?, ?, C64, 0, 0, 0, 0, 
73052499, Hong Kong sim, Hong Kong, 1933.??.??, ?, Alekhine Alexander, Pollock H., 0, ?, ?, C31, 0, 0, 0, 0, 
5254994, Hong Kong sim, Hong Kong, 1933.??.??, ?, Alekhine Alexander, Ridlington Russ, 0, ?, ?, E85, 0, 0, 0, 0, 
55457140, Hong Kong sim, Hong Kong, 1933.??.??, ?, Alekhine Alexander, Sequeira Joao F A, 1, ?, ?, C11, 0, 0, 0, 0, 
9586804, Hong Kong sim, Hong Kong, 1933.??.??, ?, Alekhine Alexander, Sequeira Joao F A, 1, ?, ?, C28, 0, 0, 0, 0, 
40017012, Hong Kong sim, Hong Kong, 1933.??.??, ?, Alekhine Alexander, Sequeira Joao F A, 1, ?, ?, D03, 0, 0, 0, 1, 
40940621, Hong Kong sim, Hong Kong, 1933.??.??, ?, Alekhine Alexander, Soltan, 1, ?, ?, B00, 0, 0, 0, 0, 
74538425, Hong Kong sim, Hong Kong, 1933.??.??, ?, Alekhine Alexander, Wong CE., 1, ?, ?, A50, 0, 0, 0, 0, 
24607052, Hong Kong sim, Hong Kong, 1933.??.??, ?, Alekhine Alexander, Davies EJ., -1, ?, ?, C29, 0, 0, 0, 0, 
58395816, Hong Kong sim, Hong Kong, 1933.??.??, ?, Alekhine Alexander, Biriukoff, 1, ?, ?, C48, 0, 0, 0, 0, 
83361218, Hong Kong sim, Hong Kong, 1933.??.??, ?, Alekhine Alexander, Paul BW., 1, ?, ?, E85, 0, 0, 0, 0, 
7722829, Hong Kong sim, Hong Kong, 1933.??.??, ?, Alekhine Alexander, Pollock H., 1, ?, ?, C25, 0, 0, 0, 0, 
62708866, Hong Kong sim, Hong Kong, 1933.??.??, ?, Alekhine Alexander, Davies EJ., 1, ?, ?, D05, 0, 0, 0, 1, 
25407564, Jakarta sim, Jakarta, 1933.??.??, ?, Wertheim W., Alekhine Alexander, -1, ?, ?, C46, 0, 0, 0, 0, 
29893476, Jakarta sim, Jakarta, 1933.??.??, ?, Alekhine Alexander, Van Hasselt CJ., 0, ?, ?, C68, 0, 0, 0, 0, 
33948955, Jakarta sim, Jakarta, 1933.??.??, ?, Alekhine Alexander, Wertheim W., -1, ?, ?, B50, 0, 0, 0, 0, 
34071186, Jakarta sim, Jakarta, 1933.??.??, ?, Alekhine Alexander, Wertheim W., 1, ?, ?, D31, 0, 0, 0, 0, 
83113583, Jakarta sim, Jakarta, 1933.??.??, ?, Engelen JC., Alekhine Alexander, -1, ?, ?, E14, 0, 0, 0, 0, 
94140613, Jakarta sim, Jakarta, 1933.??.??, ?, Frahm EDG., Alekhine Alexander, 0, ?, ?, C49, 0, 0, 0, 0, 
2876324, Jakarta sim, Jakarta, 1933.??.??, ?, Alekhine Alexander, Frahm EDG., 1, ?, ?, B20, 0, 0, 0, 0, 
21815994, Jakarta sim, Jakarta, 1933.??.??, ?, Alekhine Alexander, Rosemuller A., 1, ?, ?, D51, 0, 0, 0, 0, 
67240954, Jakarta sim, Jakarta, 1933.??.??, ?, Alekhine Alexander, Rogoveen CM., 1, ?, ?, B45, 0, 0, 0, 0, 
55370947, Jakarta sim, Jakarta, 1933.??.??, ?, Alekhine Alexander, Rumat PF., 0, ?, ?, B20, 0, 0, 0, 0, 
58369217, Jakarta sim, Jakarta, 1933.??.??, ?, Alekhine Alexander, Engelen JC., -1, ?, ?, B47, 0, 0, 0, 0, 
79533064, Jakarta sim, Jakarta, 1933.??.??, ?, Alekhine Alexander, Bleymans D., 1, ?, ?, A90, 0, 0, 0, 0, 
39645337, Malang sim, Malang, 1933.??.??, ?, Alekhine Alexander, Stegerhoek A., 1, ?, ?, C21, 0, 1, 1, 0, 
5366254, Malang sim, Malang, 1933.??.??, ?, Alekhine Alexander, Burer LC., 1, ?, ?, E85, 0, 0, 0, 0, 
65708769, Malang sim, Malang, 1933.??.??, ?, Alekhine Alexander, De Haan CMH., 0, ?, ?, C60, 0, 0, 0, 0, 
28792664, Malang sim, Malang, 1933.??.??, ?, Alekhine Alexander, Goelangge A., 0, ?, ?, B20, 0, 0, 0, 0, 
37558164, Malang sim, Malang, 1933.??.??, ?, Alekhine Alexander, Lamminga S., 0, ?, ?, D61, 0, 0, 0, 0, 
